{
  "schema_version": 1,
  "suite_id": "mock-full-catalog",
  "selection": {
    "include_tags": [],
    "exclude_tags": ["manual-only"],
    "include_scenario_ids": [],
    "exclude_scenario_ids": []
  },
  "execution": {
    "repeats": 1,
    "timeout_ms": 5000,
    "suite_timeout_ms": 300000,
    "continue_on_product_failure": true,
    "continue_on_expected_failure": true,
    "continue_on_ambiguous_hold": true,
    "stop_on_harness_failure": true,
    "stop_on_infrastructure_failure": true,
    "stop_on_state_contamination": true,
    "max_consecutive_product_failures": 5,
    "reset_policy": "rules_only",
    "runtime_mode": "mock",
    "dry_run": false,
    "mock_runtime": true
  }
}
